{
  "patch_version": "bim-json-patch/1.0",
  "target_schema_version": "bim-json/2.0",
  "target_ifc_schema": "IFC2X3",
  "target_document_id": "simple-room-base",
  "layers": [
    {
      "id": "agent-missing-001",
      "kind": "agent",
      "provenance": {
        "source": "agent-clarification",
        "turn": 2
      },
      "operations": [
        {
          "op": "mark_missing",
          "target": {
            "collection": "entities",
            "id": "wall-west",
            "path": "attributes.Representation.profile.x"
          },
          "value": {
            "reason": "用户尚未提供西墙长度",
            "questions": [
              "西侧墙的净长度是多少毫米？"
            ]
          }
        }
      ]
    }
  ]
}
